<?xml version="1.0"?>
<Component
  xsi:noNamespaceSchemaLocation="Component.xsd"
  xmlns:xsi="http://www.w3.org/2001/XMLSchema-instance"
  library="IHP 131 BiCmos components" name="Rsil" schematic_id = "Rsil">
    <Description>
        SG13G2 Salicide resistor
    </Description>
    <Models>
        <DefaultModel value="Rsil">
        </DefaultModel>
        <SpiceModel value="Rsil">
        </SpiceModel>
    </Models>
    <Netlists>
        <NgspiceNetlist value = 'Xrsil{PartCounter} {nets} rsil w={w} l={l} m={m}'>
            <Include value=".LIB {PDK_ROOT}/ihp-sg13g2/libs.tech/ngspice/models/cornerRES.lib res_typ">
            </Include>
        </NgspiceNetlist>
        <CDLNetlist value = 'R{PartCounter} {nets} rsil w={w} l={l} m={m}'> </CDLNetlist>
    </Netlists>
    <Symbols>
        <Symbol id="Standard">
           <File>{QUCS_S_COMPONENTS_LIBRARY}/Resistor.sym</File>
        </Symbol>
    </Symbols>
    <Parameters>
        <Parameter name="w" unit="um" default_value="0.5" show="true">
            <Description>Width</Description>
        </Parameter>
        <Parameter name="l" unit="um" default_value="0.5" show="true">
            <Description>Length</Description>
        </Parameter>
        <Parameter name="m" unit="" default_value="1" show="true">
            <Description>multiplier</Description>
        </Parameter>
        <Parameter name="b" unit="" default_value="0" show="true">
            <Description>Number of bends</Description>
        </Parameter>
    </Parameters>
</Component>
